id,Previous Sentence,Current Sentence,Masked Sentence,Next Sentence,AI Phrase,Suggested Mask,AI Entity,Anthropomorphic Component,Target Expression,Animated
1_acl_141_6586_10,Our model outperforms not only state-of-the-art neural models near 3 percent but also the latest statistic model.,"Especially on the two narrative prompts, our model performs much better than all other state-of-the-art models.","Especially on the two narrative prompts, [MASK] performs much better than all other state-of-the-art models.",,our model,model,model,perform,model,0
1_arx_2304.09655_1827701_1,"In recent years, large language models have been responsible for great advances in the field of artificial intelligence (AI).","ChatGPT in particular, an AI chatbot developed and recently released by OpenAI, has taken the field to the next level.","[MASK] in particular, an AI chatbot developed and recently released by OpenAI, has taken the field to the next level.","The conversational model is able not only to process human-like text, but also to translate natural language into code.",ChatGPT,ChatGPT,ChatGPT,take the field to the next level,ChatGPT,0
1_arx_2304.06122_1824168_2,"One potential use, or abuse, of ChatGPT is in answering various questions or even generating whole essays and research papers in an academic or classroom setting.","While recent works have explored the use of ChatGPT in the context of humanities, business school, or medical school, this work explores how ChatGPT performs in the context of an introductory computer engineering course.","While recent works have explored the use of [MASK] in the context of humanities, business school, or medical school, this work explores how [MASK] performs in the context of an introductory computer engineering course.","This work assesses ChatGPT's aptitude in answering quizzes, homework, exam, and laboratory questions in an introductory-level computer engineering course.",ChatGPT,ChatGPT,ChatGPT,perform,ChatGPT,0
1_arx_2304.02796_1820842_4,"In this paper, we provide a concise review of the classification and representation of design knowledge, and past efforts to support designers in acquiring knowledge.",We analyze the opportunities and challenges that ChatGPT presents for knowledge management in design and propose promising future research directions.,We analyze the opportunities and challenges that [MASK] presents for knowledge management in design and propose promising future research directions.,"A case study is conducted to validate the advantages and drawbacks of ChatGPT, showing that designers can acquire targeted knowledge from various domains, but the quality of the acquired knowledge is highly dependent on the prompt.",ChatGPT,ChatGPT,ChatGPT,present challenges and opportunities,ChatGPT,0
1_arx_2210.17127_1738482_1,,"Recent research has revealed that neural language models at scale suffer from poor temporal generalization capability, i.e., the language model pre-trained on static data from past years performs worse over time on emerging data.","Recent research has revealed that neural language models at scale suffer from poor temporal generalization capability, i.e., [MASK] pre-trained on static data from past years performs worse over time on emerging data.",Existing methods mainly perform continual training to mitigate such a misalignment.,neural language models at scale,neural language models,model,suffer from poor temporal generalization capability,neural language models,0
1_arx_2303.12767_1812564_0,We discuss the challenge of preventing data contamination and ensuring fair model evaluation in the age of closed and continuously trained models.,"ChatGPT, the first large language model (LLM) with mass adoption, has demonstrated remarkable performance in numerous natural language tasks.","[MASK] , the first large language model (LLM) with mass adoption, has demonstrated remarkable performance in numerous natural language tasks.","Despite its evident usefulness, evaluating ChatGPT's performance in diverse problem domains remains challenging due to the closed nature of the model and its continuous updates via Reinforcement Learning from Human Feedback (RLHF).",ChatGPT,ChatGPT,ChatGPT,demonstrate,ChatGPT,0
1_arx_2304.04780_1822826_0,The discussion of this work will contribute to the formalization of the XAI field.,Artificial intelligence (AI) models are increasingly finding applications in the field of medicine.,[MASK] are increasingly finding applications in the field of medicine.,Concerns have been raised about the explainability of the decisions that are made by these AI models.,Artificial intelligence (AI) models,Artificial intelligence (AI) models,model,find applications,Artificial intelligence (AI) models,0
1_arx_2304.05613_1823659_1,"Over the last few years, large language models (LLMs) have emerged as the most important breakthroughs in natural language processing (NLP) that fundamentally transform research and developments in the field.",ChatGPT represents one of the most exciting LLM systems developed recently to showcase impressive skills for language generation and highly attract public attention.,[MASK] represents one of the most exciting LLM systems developed recently to showcase impressive skills for language generation and highly attract public attention.,"Among various exciting applications discovered for ChatGPT in English, the model can process and generate texts for multiple languages due to its multilingual training data.",ChatGPT,ChatGPT,ChatGPT,represent,ChatGPT,0
1_arx_2304.06488_1824534_6,"Overall, this work is the first to survey ChatGPT with a comprehensive review of its underlying technology, applications, and challenges.","Moreover, we present an outlook on how ChatGPT might evolve to realize general-purpose AIGC (a.k.a. AI-generated content), which will be a significant milestone for the development of AGI.","Moreover, we present an outlook on how [MASK] might evolve to realize general-purpose AIGC (a.k.a. AI-generated content), which will be a significant milestone for the development of AGI.",,ChatGPT,ChatGPT,ChatGPT,evolve,ChatGPT,0
1_arx_2304.09433_1827479_3,"In this work, we ask whether we can maintain generality by using large language models (LLMs).","LLMs, which are pretrained on broad data, can perform diverse downstream tasks simply conditioned on natural language task descriptions.","[MASK] , which are pretrained on broad data, can perform diverse downstream tasks simply conditioned on natural language task descriptions.","We propose and evaluate EVAPORATE, a simple, prototype system powered by LLMs.",LLMs,LLMs,LLM,perform,LLMs,0
1_acl_18_8507_4,The paraphrasing results were again filtered using our classifier.,"While the use of additional data and our classifier filter were able to improve results, the paraphrasing model produced too many invalid outputs to further improve the output quality.","While the use of additional data and our classifier filter were able to improve results, [MASK] produced too many invalid outputs to further improve the output quality.","Our model without the paraphrasing component finished in the middle of the field for the shared task, improving over the best baseline by a margin of 10-22 % weighted F1 absolute.",the paraphrasing model,paraphrasing model,model,produce,paraphrasing model,0
1_acl_19_9312_0,The performance of this system is evaluated on Myanmar image caption corpus using BLEU scores and 10-fold cross validation.,An image captioning system involves modules on computer vision as well as natural language processing.,[MASK] involves modules on computer vision as well as natural language processing.,Computer vision module is for detecting salient objects or extracting features of images and Natural Language Processing (NLP) module is for generating correct syntactic and semantic image captions.,An image captioning system,image captioning system,system,involve,image captioning system,0
1_acl_11_13818_6,We show that it is possible to train competitive multilingual language models on less than 1 GB of text.,"Our model, named AfriBERTa, covers 11 African languages, including the first language model for 4 of these languages.","[MASK] , named AfriBERTa, covers 11 African languages, including the first language model for 4 of these languages.",Evaluations on named entity recognition and text classification spanning 10 languages show that our model outperforms mBERT and XLM-Rin several languages and is very competitive overall.,Our model,model,model,cover,model,0
1_arx_2304.07232_1825278_3,"We decided to evaluate the model because it has shown good performance on other code-based tasks, such as solving programming challenges and understanding code at a high level.","However, we found that the ChatGPT model performed no better than a dummy classifier for both binary and multi-label classification tasks for code vulnerability detection.","However, we found that [MASK] performed no better than a dummy classifier for both binary and multi-label classification tasks for code vulnerability detection.",,the ChatGPT model,ChatGPT model,model,perform,ChatGPT model,0
1_arx_265_19705_2,"Our approach, contextual universal embeddings (CUE), trains LMs on one type of contextual data and adapts to novel context types.","The model consists of a pretrained neural sentence LM, a BERT-based contextual encoder, and a masked transfomer decoder that estimates LM probabilities using sentence-internal and contextual evidence.","[MASK] consists of a pretrained neural sentence LM, a BERT-based contextual encoder, and a masked transfomer decoder that estimates LM probabilities using sentence-internal and contextual evidence.","When contextually annotated data is unavailable, our model learns to combine contextual and sentence-internal information using noisy oracle unigram embeddings as a proxy.",The model,model,model,consist of,model,0
1_arx_1005.1737_189277_4,We proposed an innovative system named Wireless Sensor Network Air Pollution Monitoring System (WAPMS) to monitor air pollution in Mauritius through the use of wireless sensors deployed in huge numbers around the island.,The proposed system makes use of an Air Quality Index (AQI) which is presently not available in Mauritius.,[MASK] makes use of an Air Quality Index (AQI) which is presently not available in Mauritius.,"In order to improve the efficiency of WAPMS, we have designed and implemented a new data aggregation algorithm named Recursive Converging Quartiles (RCQ).",The proposed system,system,system,make use,system,0
1_arx_1109.0704_285072_6,"In addition, we pump a steadily increasing magnetic flux into the corona, in order to increase the coronal temperature through the dissipation of magnetic stresses.","As a consequence, the model covers different ranges of coronal temperatures as time progresses.","As a consequence, [MASK] covers different ranges of coronal temperatures as time progresses.",The model covers coronal temperatures that are representative of plasma conditions in coronal holes and quiet sun.,the model,model,model,cover,model,0
1_arx_1208.6130_366702_5,"Heat back-flow due to phonons and photons stop cooling at a temperature above absolute zero, and above a certain threshold turns the discontinuity into a sharp cusp.",We also give a heuristic condition for when an arbitrary system's nonlinear response means that its ZT ceases to indicate (even qualitatively) the lowest temperature to which the system can refrigerate.,We also give a heuristic condition for when [MASK] means that its ZT ceases to indicate (even qualitatively) the lowest temperature to which the system can refrigerate.,,the system,system,system,refrigerate,system,0
1_arx_1502.04791_599451_0,The paper tries to explore this shift in AI systems design philosophy.,"Over the past decade, AI has made remarkable progress.","Over the past decade, [MASK] has made remarkable progress.",It is agreed that this is due to the recently revived Deep Learning technology.,AI,AI,AI,make progress,AI,0
1_arx_71_26792_1,Cross-lingual transfer learning is an important property of multilingual large language models (LLMs).,But how do LLMs represent relationships between languages?,But how do [MASK] represent relationships between languages?,Every language model has an input layer that maps tokens to vectors.,LLMs,LLMs,LLM,represent,LLMs,0
1_arx_1706.07107_861842_4,"To account for the observed surface tension evolution with the degree of grafting we propose a scenario, where the free-energy barrier results from both the deformation of the incoming polymer coils and the deformation of the adsorbed brush.","Our model involves only two fitting parameters, the monomer size and the area needed for one molecule during adsorption and is in agreement with the experimental data.","[MASK] involves only two fitting parameters, the monomer size and the area needed for one molecule during adsorption and is in agreement with the experimental data.","We obtain a reasonable value for the monomer size and find an area per adsorbed polymer chain of the order of 1nm$^2$, showing that the polymer chains are strongly stretched as they adsorb.",Our model,model,model,involve,model,0
1_arx_1708.08160_883172_9,The model we developed has given more successful results compared to other methods.,We foresee that our model will bring a new dimension to medical research and the medical industry.,We foresee that [MASK] will bring a new dimension to medical research and the medical industry.,,our model,model,model,bring a new dimension,model,0
1_arx_1706.09554_864289_2,Emotions play a central role in most forms of natural human interaction so we may expect that computational methods for the processing and expression of emotions will play a growing role in human-computer interaction.,The OCC model has established itself as the standard model for emotion synthesis.,[MASK] has established itself as the standard model for emotion synthesis.,A large number of studies employed the OCC model to generate emotions for their embodied characters.,The OCC model,OCC model,model,establish,OCC model,0
1_acl_3_33196_3,"However, the process behind their outputs remains a black box, making it difficult to ascertain the data influencing their responses.","These AI models do not always produce accurate outputs and are known for generating incorrect information, known as hallucinations, whose causes are hard to pinpoint.","[MASK] do not always produce accurate outputs and are known for generating incorrect information, known as hallucinations, whose causes are hard to pinpoint.","Moreover, they still face challenges in solving complex problems that require step-by-step reasoning, despite various improvements like the Chain-of-Thought approach.",These AI models,AI models,model,produce,AI models,0
1_arx_2009.13222_1354725_0,The visualization and the up-to-date FRM can be found on hu.berlin/frm.,AI artificial intelligence brings about new quantitative techniques to assess the state of an economy.,[MASK] brings about new quantitative techniques to assess the state of an economy.,Here we describe a new measure for systemic risk: the Financial Risk Meter (FRM).,AI artificial intelligence,AI artificial intelligence,intelligence,bring about,AI artificial intelligence,0
1_arx_2010.08309_1364639_2,The adopted UHF PD time difference of arrival (TDOA) methods mainly use the time difference of electromagnetic wave signals.,"Thus, the system requires both a high sampling rate and time synchronization accuracy, leading to a high cost and large size.","Thus, [MASK] requires both a high sampling rate and time synchronization accuracy, leading to a high cost and large size.","In this study, the feasibility and accuracy of PD DOA in an AIS were investigated using a UHF wireless sensor array and the received signal strength indicator.",the system,system,system,require,system,0
1_acl_1023_35862_2,"However, these methods are typically evaluated on conventional Knowledge Graph Question Answering (KGQA) with complete KGs, where all factual triples required for each question are entirely covered by the given KG.","In such cases, LLMs primarily act as an agent to find answer entities within the KG, rather than effectively integrating the internal knowledge of LLMs and external knowledge sources such as KGs.","In such cases, [MASK] primarily act as an agent to find answer entities within the KG, rather than effectively integrating the internal knowledge of [MASK] and external knowledge sources such as KGs.","In fact, KGs are often incomplete to cover all the knowledge required to answer questions.",LLMs,LLMs,LLM,act,LLMs,0
1_acl_1262_36095_8,Our findings suggest both our proposed methods perform better than other AI text detectors.,"Our RR model is more robust, although our TF model performs better than the RR model without any attacks.","[MASK] is more robust, although our TF model performs better than the RR model without any attacks.","We make our code, dataset, model public.",our TF model,TF model,model,perform,TF model,0
1_arx_2103.01063_1431208_6,"Finally, we carry out simulations and comparisons to view the trade-off and validate the effectiveness of the proposed algorithm, in the presence of distinct levels of estimation uncertainty and user mobility.","Our results demonstrate that the proposed algorithm can find the joint optimal solution for the position/orientation estimation accuracy and EADR, with its optimization performance being robust to slight localization or channel estimation errors and user mobility.","Our results demonstrate that [MASK] can find the joint optimal solution for the position/orientation estimation accuracy and EADR, with its optimization performance being robust to slight localization or channel estimation errors and user mobility.",,the proposed algorithm,algorithm,algorithm,find,algorithm,0
1_arx_2103.13494_1443639_2,We used data from 23 provinces in Italy to build a generalized additive model to investigate the association between the effective reproductive number of the disease and air quality while controlling for ambient environmental variables and changes in human mobility.,"The model finds that there is a positive, nonlinear relationship between the density of particulate matter in the air and COVID-19 transmission, which is in alignment with similar studies on other respiratory illnesses.","[MASK] finds that there is a positive, nonlinear relationship between the density of particulate matter in the air and COVID-19 transmission, which is in alignment with similar studies on other respiratory illnesses.",,The model,model,model,find,model,0
1_acl_110_36259_1,Large language models (LLMs) have demonstrated prowess in a wide range of tasks.,"However, many LLMs exhibit significant performance discrepancies between high- and low-resource languages.","However, [MASK] exhibit significant performance discrepancies between high- and low-resource languages.","To mitigate this challenge, we present FuxiTranyu, an open-source multilingual LLM, which is designed to satisfy the need of the research community for balanced and high-performing multilingual capabilities.",many LLMs,LLMs,LLM,exhibit performance discrepancies,LLMs,0
1_arx_2108.01174_1509989_0,"To understand and validate an AI system's outcomes (such as classification, recommendations, predictions), that lead to developing trust in the AI system, it is necessary to involve explicit domain knowledge that humans understand and use.",AI systems have seen significant adoption in various domains.,[MASK] have seen significant adoption in various domains.,"At the same time, further adoption in some domains is hindered by inability to fully trust an AI system that it will not harm a human.",AI systems,AI systems,system,see adoption,AI systems,0
1_acl_132_36620_1,Language models (LMs) have greatly propelled the research on natural language processing.,"However, LMs also raise concerns regarding the generation of biased or toxic content and the potential disclosure of private information from the training dataset.","However, [MASK] also raise concerns regarding the generation of biased or toxic content and the potential disclosure of private information from the training dataset.","In this work, we present a new efficient approach, Ethos, that rectifies LMs to mitigate toxicity and bias in outputs and avoid privacy leakage.",LMs,LMs,LM,raise concerns,LMs,0
1_acl_14_30365_3,"Our final submission was a transformer model utilizing data from a similar domain and data augmentation by large language models, as well as content-based segmentation.",The model produces summaries covering meeting topics and next steps and performs comparably to a large language model at a fraction of the cost.,[MASK] produces summaries covering meeting topics and next steps and performs comparably to a large language model at a fraction of the cost.,"We also find that re-summarizing the summaries with the same model allows for an alternative, shorter summary.",The model,model,model,"produce,perform",model,0
1_arx_2304.02210_1820256_0,We release our data and annotations at https://github.com/longyuewangdcu/Document-MT-LLM.,"Large language models (LLMs) such as ChatGPT can produce coherent, cohesive, relevant, and fluent answers for various natural language processing (NLP) tasks.","Large language models ( [MASK] ) such as ChatGPT can produce coherent, cohesive, relevant, and fluent answers for various natural language processing (NLP) tasks.","Taking document-level machine translation (MT) as a testbed, this paper provides an in-depth evaluation of LLMs' ability on discourse modeling.",Large language models (LLMs),Large language models (LLMs),model,produce,Large language models (LLMs),0
1_arx_2304.05077_1823123_1,"We demonstrate that if consciousness is relevant for the temporal evolution of a system's states--that is, if it is dynamically relevant--then AI systems cannot be conscious.","That is because AI systems run on CPUs, GPUs, TPUs or other processors which have been designed and verified to adhere to computational dynamics that systematically preclude or suppress deviations.","That is because [MASK] run on CPUs, GPUs, TPUs or other processors which have been designed and verified to adhere to computational dynamics that systematically preclude or suppress deviations.","The design and verification preclude or suppress, in particular, potential consciousness-related dynamical effects, so that if consciousness is dynamically relevant, AI systems cannot be conscious.",AI systems,AI systems,system,run,AI systems,0
1_arx_2303.10577_1810374_8,Our solution involves two algorithms: a hybrid learning algorithm and a meta-learning algorithm.,The hybrid learning algorithm can effectively find the solution for the formulated problem.,[MASK] can effectively find the solution for the formulated problem.,"Specifically, the meta-learning algorithm can further exploit the neurodiversity of the EEG signals across multiple users, leading to higher classification accuracy.",The hybrid learning algorithm,hybrid learning algorithm,algorithm,find,hybrid learning algorithm,0
1_arx_1602.00147_700426_2,"By comparing the degree of each node in the model network and the WAN, we observe that the difference between the two is minimized for $\alpha\approx 2$. Interestingly, this is the value obtained for the node-node correlation function in the WAN.",This suggests that our model explains quite well the growth of airline networks.,This suggests that [MASK] explains quite well the growth of airline networks.,,our model,model,model,explain,model,0
1_arx_1304.1739_420872_4,"In this paper, we have presented a model for the deterministic component of the ear-to-ear link loss.",The model takes into account the dominant paths having most of the power of the creeping wave from the transceiver in one ear to the transceiver in other ear and the effect of the protruding part of the outer ear called pinna.,[MASK] takes into account the dominant paths having most of the power of the creeping wave from the transceiver in one ear to the transceiver in other ear and the effect of the protruding part of the outer ear called pinna.,Simulations are done to validate the model using in-the-ear (ITE) placement of antennas at 2.45 GHz on two heterogeneous phantoms of different age-group and body size.,The model,model,model,take into account,model,0
1_acl_282_44833_0,"OLMES includes well-considered, documented recommendations guided by results from existing literature as well as new experiments resolving open questions.",Progress in AI is often demonstrated by new models claiming improved performance on tasks measuring model capabilities.,Progress in AI is often demonstrated by new models claiming improved performance on tasks measuring [MASK] .,"Evaluating language models can be particularly challenging, as choices of how a model is evaluated on a task can lead to large changes in measured performance.",new models,models,model,claim,models,0
1_acl_54_3473_4,"On the other hand, end-to-end dialogue systems with monolithic neural architecture are often trained only with input-output utterances, without taking into account the entire annotations available in the corpus.",This scheme makes it difficult for goal-oriented dialogues where the system needs to integrate with external systems or to provide interpretable information about why the system generated a particular response.,This scheme makes it difficult for goal-oriented dialogues where [MASK] needs to integrate with external systems or to provide interpretable information about why [MASK] generated a particular response.,"In this paper, we present an end-to-end neural architecture for dialogue systems that addresses both challenges above.",the system,system,system,generate,system,0
