id,Previous Sentence,Current Sentence,Masked Sentence,Next Sentence,AI Phrase,Suggested Mask,AI Entity,Anthropomorphic Component,Target Expression,Animated
1_acl_327_3746_2,The proposed method evaluates a translation hypothesis in a regression model.,"The model takes the paired source, reference, and hypothesis sentence all together as an input.","[MASK] takes the paired source, reference, and hypothesis sentence all together as an input.","A pretrained large scale cross-lingual language model encodes the input to sentence-pair vectors, and the model predicts a human evaluation score with those vectors.",the model,model,model,take as input,model,0
1_arx_0705.4412_8414_2,We present a computerized system designed to improve percutaneous renal access by projecting the ultrasound puncture tract onto fluoroscopic images.,Materials and Methods: The system consists of a computer and a localizer allowing spatial localization of the position of the various instruments.,Materials and Methods: [MASK] consists of a computer and a localizer allowing spatial localization of the position of the various instruments.,"Without any human intervention, the ultrasound nephrostomy tract is superimposed in real time onto fluoroscopic images acquired in various views.",The system,system,system,consist of,system,0
1_acl_409_5999_0,"The goals of this empirical paper are to 1) investigate probing techniques, especially from the unsupervised mutual information aspect, 2) provide guidelines of pre-trained language model selection for the dialogue research community, 3) find insights of pre-training factors for dialogue application that may be the key to success.",This paper investigates pre-trained language models to find out which model intrinsically carries the most informative representation for task-oriented dialogue tasks.,This paper investigates pre-trained language models to find out [MASK] intrinsically carries the most informative representation for task-oriented dialogue tasks.,We approach the problem from two aspects: supervised classifier probe and unsupervised mutual information probe.,model,model,model,carry,model,0
1_acl_15_7080_7,The system is developed using Python and Flask Framework.,This Machine Translation system accepts announcements in the form of English text as input and produces Indian Sign Language (ISL) synthetic animations as output.,[MASK] accepts announcements in the form of English text as input and produces Indian Sign Language (ISL) synthetic animations as output.,,This Machine Translation system,Machine Translation system,system,accept,Machine Translation system,0
1_acl_0709.0625_22890_4,"The algorithm uses an exact or approximative low-rank representation of the identity-by-descent matrix, which combined with the Woodbury formula for matrix inversion results in that the computations in the AI-REML iteration body can be performed more efficiently.","For cases where an exact low-rank representation of the IBD matrix is available a-priori, the improved AI-REML algorithm normally runs almost twice as fast compared to the standard version.","For cases where an exact low-rank representation of the IBD matrix is available a-priori, [MASK] normally runs almost twice as fast compared to the standard version.","When an exact low-rank representation is not available, a truncated spectral decomposition is used to determine a low-rank approximation.",the improved AI-REML algorithm,AI-REML algorithm,algorithm,run,AI-REML algorithm,0
1_arx_2109.11129_1533950_3,"In this paper, we propose cross-lingual language model meta-pretraining, which learns the two abilities in different training phases.","Our method introduces an additional meta-pretraining phase before cross-lingual pretraining, where the model learns generalization ability on a large-scale monolingual corpus.","Our method introduces an additional meta-pretraining phase before cross-lingual pretraining, where [MASK] learns generalization ability on a large-scale monolingual corpus.","Then, the model focuses on learning cross-lingual transfer on a multilingual corpus.",the model,model,model,learn,model,0
1_arx_1809.03964_1023980_3,"We forecast three air pollutants (i.e., PM2.5, PM10 and O3) of monitoring stations over the next 48 hours, using a hybrid deep learning model consists of inferential predictor (inference for regions without air pollution readings), spatial predictor (capturing spatial correlations using CNN) and temporal predictor (capturing temporal relationship using sequence-to-sequence model with simplified attention mechanism).",Our proposed model considers historical air pollution records and historical meteorological data.,[MASK] considers historical air pollution records and historical meteorological data.,"We evaluate our model on a large-scale dataset containing air pollution records of 35 monitoring stations and grid meteorological data in Beijing, China.",Our proposed model,model,model,consider,model,0
1_arx_2107.06031_1500043_3,"In this study, we developed an Explainable Boosting Machine (EBM) model to predict fuel consumption of different types of industrial vehicles, using real-world data collected from 2020 to 2021.","This Machine Learning model also explains the relationship between the input factors and fuel consumption, quantifying the individual contribution of each one of them.","[MASK] also explains the relationship between the input factors and fuel consumption, quantifying the individual contribution of each one of them.",The explanations provided by the model are compared with domain knowledge in order to see if they are aligned.,This Machine Learning model,Machine Learning model,model,explain,Machine Learning model,0
1_acl_261_9142_1,"In this paper, we describe the participation of IITP-AINLPML team in the SemEval-2020 SharedTask 12 on Offensive Language Identification and Target Categorization in English Twitter data.",Our proposed model learns to extract textual features using a BiGRU-based deep neural network supported by a Hierarchical Attention architecture to focus on the most relevant areas in the text.,[MASK] learns to extract textual features using a BiGRU-based deep neural network supported by a Hierarchical Attention architecture to focus on the most relevant areas in the text.,We leverage the effectiveness of multitask learning while building our models for sub-task A and B.,Our proposed model,model,model,learn,model,0
1_arx_0807.4086_75079_10,The first is a study of the relationship between body-mass index and depression in elderly people.,"The second is the choice between models of HIV dynamics, where one model makes the distinction between activated CD4+ T lymphocytes and the other does not.","The second is the choice between models of HIV dynamics, where [MASK] makes the distinction between activated CD4+ T lymphocytes and the other does not.",,one model,model,model,make a distinction,model,0
1_acl_34_15815_4,"Then, we post-train the translation model with different levels of data at each training stages.","As the training stages go on, we make the system learn to solve multiple tasks by adding extra information at different training stages gradually.","As the training stages go on, we make [MASK] learn to solve multiple tasks by adding extra information at different training stages gradually.",We also show a way to utilize the additional data in large volume for APE tasks.,the system,system,system,learn,system,0
1_arx_2304.09161_1827207_1,"When asked, large language models (LLMs) like ChatGPT claim that they can assist with relevance judgments but it is not clear whether automated judgments can reliably be used in evaluations of retrieval systems.","In this perspectives paper, we discuss possible ways for LLMs to support relevance judgments along with concerns and issues that arise.","In this perspectives paper, we discuss possible ways for [MASK] to support relevance judgments along with concerns and issues that arise.","We devise a human--machine collaboration spectrum that allows to categorize different relevance judgment strategies, based on how much humans rely on machines.",LLMs,LLMs,LLM,support,LLMs,0
1_acl_153_4884_5,"In this paper, we propose an effective multi-task learning method to overcome the limitations of previous works.","By combining relation prediction and relevance ranking tasks with our target link prediction, the proposed model can learn more relational properties in KGs and properly perform even when lexical similarity occurs.","By combining relation prediction and relevance ranking tasks with our target link prediction, [MASK] can learn more relational properties in KGs and properly perform even when lexical similarity occurs.",Experimental results show that we not only largely improve the ranking performances compared to KG-BERT but also achieve the state-of-the-art performances in Mean Rank and Hits@10 on the WN18RR dataset.,the proposed model,model,model,learn,model,0
1_arx_0802.0733_48030_1,"Using a Markov Chain Monte Carlo optimization algorithm and a computer simulation, I find the passenger ordering which minimizes the time required to board the passengers onto an airplane.",The model that I employ assumes that the time that a passenger requires to load his or her luggage is the dominant contribution to the time needed to completely fill the aircraft.,[MASK] that I employ assumes that the time that a passenger requires to load his or her luggage is the dominant contribution to the time needed to completely fill the aircraft.,The optimal boarding strategy may reduce the time required to board and airplane by over a factor of four and possibly more depending upon the dimensions of the aircraft.,The model that I employ,model,model,assume,model,0
1_arx_2304.08979_1827025_1,The way users acquire information is undergoing a paradigm shift with the advent of ChatGPT.,"Unlike conventional search engines, ChatGPT retrieves knowledge from the model itself and generates answers for users.","Unlike conventional search engines, [MASK] retrieves knowledge from the model itself and generates answers for users.",ChatGPT's impressive question-answering (QA) capability has attracted more than 100 million users within a short period of time but has also raised concerns regarding its reliability.,ChatGPT,ChatGPT,ChatGPT,"retrieve,generate",ChatGPT,0
1_arx_2212.11136_1767313_2,Many successes have been reported where AI systems even surpassed the accuracy of human experts.,"However, AI systems may produce errors, can exhibit bias, may be sensitive to noise in the data, and often lack technical and judicial transparency resulting in reduction in trust and challenges in their adoption.","However, [MASK] may produce errors, can exhibit bias, may be sensitive to noise in the data, and often lack technical and judicial transparency resulting in reduction in trust and challenges in their adoption.","These recent shortcomings and concerns have been documented in scientific but also in general press such as accidents with self driving cars, biases in healthcare, hiring and face recognition systems for people of color, seemingly correct medical decisions later found to be made due to wrong reasons etc.",AI systems,AI systems,system,"produce,exhibit bias,lack technical and judicial transparency",AI systems,0
1_arx_2012.11995_1399873_3,We find that models pre-trained on unstructured data beat those trained directly from scratch on downstream tasks.,Our results also show that pre-training on structured data does not always make the model acquire ability that can be transferred to natural language downstream tasks.,Our results also show that pre-training on structured data does not always make [MASK] acquire ability that can be transferred to natural language downstream tasks.,"To our great astonishment, we uncover that pre-training on certain non-human language data gives GLUE performance close to performance pre-trained on another non-English language.",the model,model,model,acquire ability,model,0
1_arx_2303.16870_1816667_1,We present an overview of the complex systems field using ChatGPT as a representation of the community's understanding.,"ChatGPT has learned language patterns and styles from a large dataset of internet texts, allowing it to provide answers that reflect common opinions, ideas, and language patterns found in the community.","[MASK] has learned language patterns and styles from a large dataset of internet texts, allowing it to provide answers that reflect common opinions, ideas, and language patterns found in the community.","Our exploration covers both teaching and learning, and research topics.",ChatGPT,ChatGPT,ChatGPT,learn,ChatGPT,0
1_arx_2108.06159_1514974_0,The robustness testing methodology is described and analysed for the example use case of traffic sign recognition in autonomous driving.,"In the last years, AI systems, in particular neural networks, have seen a tremendous increase in performance, and they are now used in a broad range of applications.","In the last years, [MASK] , in particular neural networks, have seen a tremendous increase in performance, and they are now used in a broad range of applications.","Unlike classical symbolic AI systems, neural networks are trained using large data sets and their inner structure containing possibly billions of parameters does not lend itself to human interpretation.",AI systems,AI systems,system,see,AI systems,0
